{
  "$schema": "https://json-schema.org/draft/2020-12/schema",
  "$id": "wave2d_evaluation_request.schema.json",
  "title": "Wave 2D Evaluation Request",
  "type": "object",
  "required": [
    "contract_version",
    "wave",
    "request_id",
    "control_id",
    "target_id",
    "applicability_state",
    "requested_at_utc"
  ],
  "properties": {
    "contract_version": {
      "const": "1.0"
    },
    "wave": {
      "const": "2D"
    },
    "request_id": {
      "type": "string",
      "minLength": 1
    },
    "control_id": {
      "type": "string",
      "pattern": "^EMS-CTRL-[0-9]{3}$"
    },
    "target_id": {
      "type": "string",
      "minLength": 1
    },
    "repository_name": {
      "type": "string",
      "minLength": 1
    },
    "applicability_state": {
      "const": "APPLICABLE"
    },
    "requested_at_utc": {
      "type": "string",
      "format": "date-time"
    },
    "control_definition_sha256": {
      "type": "string",
      "pattern": "^[a-fA-F0-9]{64}$"
    },
    "applicability_matrix_sha256": {
      "type": "string",
      "pattern": "^[a-fA-F0-9]{64}$"
    },
    "requested_evidence_types": {
      "type": "array",
      "items": {
        "type": "string"
      }
    },
    "target_type": {
      "type": "string",
      "enum": [
        "REPOSITORY",
        "ORGANIZATION",
        "ARCHIVED_REPOSITORY_SNAPSHOT"
      ]
    },
    "evaluation_role": {
      "type": "string",
      "enum": [
        "AUTHORITATIVE_EVALUATION",
        "PROJECTION"
      ]
    },
    "organization_id": {
      "type": "string",
      "minLength": 1
    },
    "organization_name": {
      "type": "string",
      "minLength": 1
    },
    "evidence_provider_type": {
      "type": "string",
      "enum": [
        "FILE"
      ]
    },
    "evidence_provider_reference": {
      "type": "string",
      "minLength": 1
    },
    "evidence_authority": {
      "type": "string",
      "minLength": 1
    },
    "evidence_timestamp": {
      "type": "string",
      "format": "date-time"
    },
    "archive_source_sha256": {
      "type": "string",
      "pattern": "^[a-fA-F0-9]{64}$"
    },
    "archive_evidence_source_class": {
      "const": "ARCHIVE_REPOSITORY_CONTENT"
    }
  },
  "additionalProperties": false,
  "allOf": [
    {
      "if": {
        "properties": {
          "target_type": {
            "const": "ARCHIVED_REPOSITORY_SNAPSHOT"
          }
        },
        "required": [
          "target_type"
        ]
      },
      "then": {
        "required": [
          "archive_source_sha256",
          "archive_evidence_source_class"
        ],
        "properties": {
          "target_id": {
            "pattern": "^ARCHIVE-[A-F0-9]{24}$"
          }
        }
      }
    },
    {
      "if": {
        "properties": {
          "target_type": {
            "const": "REPOSITORY"
          }
        },
        "required": [
          "target_type"
        ]
      },
      "then": {
        "properties": {
          "target_id": {
            "not": {
              "pattern": "^ARCHIVE-"
            }
          }
        }
      }
    }
  ]
}
